line1,line2,line3,source
delicate savage,you'll never hold the cinder,but still you will burn,bfbarry
our destination,the skyline of this city,shining horizon,bfbarry
a splash and a cry,words pulled from the riverside,dried in the hot sun,bfbarry
hurt but poised for war,sturdy in crestfallen slumps,warrior spirit,bfbarry
steamy mist rising,rocks receiving downward crash,as the jungle weeps,bfbarry
a sultry wine night,spent with a beautiful girl,brash kiss ends smooth jazz,bfbarry
you were broken glass,but i touched you even though,i knew it would hurt,bfbarry
say not that i have,fled from the world but that the,world has fled from me,bfbarry
eyes dance with firelight,the moon and i are lovers,the spiteful sun dies,bfbarry
i woke up today,i wanted to write a song,i wrote a haiku,bfbarry
why do you hate me,bored of my dumb brain,tired of this haiku,bfbarry
know when to quit friend,no time to waste in this space,live well to the end,bfbarry
if only your luck,had spiked back then in vegas,my life is misfortune,bfbarry
ritual to relax,has evolved over the time,the effects profound,bfbarry
gazing upon plains,a loving wind warms my nose,the sun behind me,bfbarry
the lion limped out,and flipped his tail at march when,fleecy frolicked in,bfbarry
your words are wounding,your tongue a bloody scalpel,your aim perfection,bfbarry
time stopped when you spoke,my chest heaved my breath shortened,our candle burnt out,bfbarry
empty bleeding womb,stark white faces sad eyes say,sorry for your loss,bfbarry
a sparking of stems,ignited the blazing for,red maple torches,bfbarry
it ebbs and flows now,my will a rock in the swell,i sink beneath it,bfbarry
finally they're gone,my chaotic family,now peace and silence,bfbarry
coming up with poem,takes some consideration,this is the result,bfbarry
tragedy it seemed,awakening it was though,happiness will come,bfbarry
always doomscrolling,very stressful times indeed,need someone to lead,bfbarry
searching the ashes,finding questions unanswered,leaving with charred hands,bfbarry
your heart is a dead,fortress with walls that swallow,my cries to be free,bfbarry
dreams of youth,love realized bridged the gaps,forwardeyes raised,bfbarry
care must be taken,risk always necessary,treading the needle,bfbarry
dark roof cavity,rodent highway or phantoms,scratch scrape and shuffle,bfbarry
roses are not red,violets never completely blue,kitty is the one,bfbarry
i just need some time,for rest and healing and change,i'll get better soon,bfbarry
river wash my pain,the winds softly sing your name,all flows subliminally,bfbarry
trump is really bad,he will end america,world war three is real,bfbarry
she was so broken,he pieced her back together,and broke her himself,bfbarry
smile forevermore,mother nature will laugh back,now my world is bright,bfbarry
my first day of cake,what a fabulous feeling,another blue cheese,bfbarry
real roses have thorns,they teach appreciation,without holding on,bfbarry
all the bees and trees,won't even briefly lament,human extinction,bfbarry
i can float away,into the deep dark abyss,welcomed by the stars,bfbarry
my mind betrays me,each night by dreaming of him,nowhere left to run,bfbarry
washing the dishes,thinking about a haiku,words flow like water,bfbarry
prayer at the start,prayer with each twist and turn,prayer filled with thanks,bfbarry
worms in a circle,circle in the infinite,infinite in the,bfbarry
waves roll west to east,observed by october trees,echoes of a crow,bfbarry
dark room and moonlight,fingers reek of nicotine,another cold night,bfbarry
crystals billowing in an ocean,a fairy guides a herd of pollen,happy frogs croaking,bfbarry
take a look through me,i'm essentially empty,man the breathing husk,bfbarry
junkie ghouls linger,near the kmart sepulchre,new necropolis,bfbarry
she lifts her ass high,where she looks her gaze demands,spank me harder please,bfbarry
clatter of bottles,and the dense breath of a man,she prays for daylight,bfbarry
smoke drifts doubt aside,opportunity in hand,another face plant,bfbarry
small steps to healing,years of damage to repair,i am in no rush,bfbarry
i lay here in bed,my thoughts full of fear and dread,i wish i were dead,bfbarry
you take this away,i will destroy your message,god is dementia,bfbarry
money the force here,drives us and intertwines us,break us from this bond,bfbarry
obvious artist,no signature required for,landscapes in the fall,bfbarry
light or dark inside,songbirds sing in the sunshine,owls glide true at night,bfbarry
i can't get up,elephant on my chest,i can barely breath,bfbarry
it strange how you can,surround yourself with people,yet still feel alone,bfbarry
in one swift movement,a heron swallows a fish,and then flies away,bfbarry
white sands on the beach,and pink petals off a branch,drifting in the wind,bfbarry
sacramentsyour gift,opened they have all i need,your love so perfect,bfbarry
my cheeks are sandy,square pants star lives under rock,alaskan bull worm,bfbarry
trickling water,dense groves of veridian,aged stones half buried,bfbarry
i wish to send you,a video of a crow,sucks for you i'm blocked,bfbarry
no one dies today,not inside my influence,and not on my watch,bfbarry
the calm river flows,branches lurch in the waters,ripples tell the tale,bfbarry
test of faith,today i will face it,empowered by love,bfbarry
live your fantasies,your dreams can be memories,just stay out of jail,bfbarry
what we leave behind,is how we are remembered,plastic is garbage,bfbarry
a turning point reached,decisions and decisions,to be bold beyond,bfbarry
you were turned over,rainbow sheened worlds floating free,your bnbbles poured out,bfbarry
yesterday lit up the sky,when darkness comes,moon will guide you,bfbarry
i met a poacher,asked him why he liked to kill,just kidding shot him,bfbarry
hopelessly naive,pining 'til the crack of dawn,my bell never rings,bfbarry
progress is all gone,i gave into my vices,time to start over,bfbarry
my grief counselor,was excellent and just died,i don't feel a thing,bfbarry
contemplating time,for how slow everyday feels,this year ended quick,bfbarry
words fall short of you,beauty gorgeous not enough,you inspire me,bfbarry
in love with bundy,death just around the corner,laugh into the sea,bfbarry
why is it so hard,just to get a job right now,paying living wage,bfbarry
foot in a puddle,a forgotten parking lot,good place to daydream,bfbarry
bifurcated hams,just jack off my fag penis,ignore the straight one,bfbarry
normally i'd sleep,but sleeping won't save me now,not from this heartbreak,bfbarry
i just kissed a grill,had to prove that i'm not gay,shit i'm gunna puke,bfbarry
listen she's breathless,look into her bloodshot eyes,should i let go yet,bfbarry
and when they landed,after waves of fire reigned down,i knew we had lost,bfbarry
the river bed was,throwing off the cover and,broke the winter quilt,bfbarry
seething emotions,churning thoughts feelings askew,all i blurt is hi,bfbarry
will we reconnect,positive thoughts ensure it,we will reconnect,bfbarry
i searched north to south,despondency was my spoils,rescued by your smile,bfbarry
a peaceful sunrise,discovers the idle streets,the drunkard blinded,bfbarry
little by little,exceptions never met,sand slips through my hands,bfbarry
a secluded place,alone away from all else,i long to live in,bfbarry
a tap from winter,reminded the cars in a,whirling of petals,bfbarry
boil these dry leaves,pour the water in my cup,you have spilled the tea,bfbarry
the empty ink pen,so lonely on my dresser,begs me to use it,bfbarry
twinkling stars above,like golden fish in a pond,withdrawn swim through time,bfbarry
letter of request,it is against company,policy to die,bfbarry
rob really did it,a new city a new job,two holes in the ground,bfbarry
it has betrayed me,heart pumping eyes wide awake,sleep i summon thee,bfbarry
beautiful immense,poseidon like the sea,washes o'er my soul,bfbarry
hidden strength built up,from years of struggle and pain,you are now mighty,bfbarry
get rid of your junk,and you will finally have,room for your treasure,bfbarry
this shit just got real,a big promotion ahead,it's mine if i want,bfbarry
endlessness outweighed,as a feather falls to earth,lifted by the breeze,bfbarry
vast existence we,god gravity is to be,universal truth,bfbarry
six months intertwined,tangled bodies under sheets,knot slowly fraying,bfbarry
i look for shelter,and find a new hiding place,underneath the pines,bfbarry
two unsteady feet,steel themselves for another,failed attempt to fly,bfbarry
man and the machine,how are you today but just,spits out a receipt,bfbarry
hey ups guy,what does that red sticker say,it's fragile dumb dumb,bfbarry
one on one time wow,each moment so close perfect,once again lord thanks,bfbarry
today is the day,tomorrow is now today,today is the day,bfbarry
mercury poisoned,the kid went to therapy,and misdiagnosed,bfbarry
frost on the river,all boats have been pulled in tight,chicks are home to roost,bfbarry
a battered housewife,hiding out in her kitchen,prepares tempura,bfbarry
loosely braided stems,a dainty crown for a queen,small yellow stained hands,bfbarry
long day in summer,bright sky warm wind yet now,storm is coming,bfbarry
when you told me that,you had three fewer children,who was sacrificed,bfbarry
ah bonjour tristesse,i am emotionally,unavailable,bfbarry
i run far away,nothing but the essentials,keeping my friends safe,bfbarry
people's dilemma,in the last breath of freedom,thunderous applause,bfbarry
blood and tears dripping,energy drained passion gained,exist profoundly,bfbarry
we live in a plague,a time most dire indeed,we will hold the line,bfbarry
an ancient city,silent sands consume his name,ozymandias,bfbarry
sometimes it's just there,like a lead weight on your chest,compressing your soul,bfbarry
weed in the garden,gentle squeeze of the trigger,death of the haiku,bfbarry
no real purpose here,where is my life going now,fuck i want to die,bfbarry
shade of a tall tree,becomes a welcoming breeze,breath tranquility,bfbarry
clear was your anger,stranger how i prayed for you,find the love you seek,bfbarry
i cannot think straight,i feel alone completely,irreparable,bfbarry
you're counting the days,segue to weeks months and years,inevitable,bfbarry
i love you so much,you are the best on the earth,daddy i love you,bfbarry
i cannot rise see,i am not bread all day long,laying in my bed,bfbarry
she's a burrito,always getting stuffed so full,get it she cucks me,bfbarry
communal silence,we all listen together,our creator speaks,bfbarry
howling wind rattles,the broken summer awning,that broke from the wind,bfbarry
tired of smart decisions,artificial hapiness,nobody's perfect,bfbarry
i dreamt i was dead,a dark curtain between sides,i was asleep right,bfbarry
three in the morning,times ticking by as i scroll,i'm craving for sleep,bfbarry
joy did it pierce you,love burning our hearts and souls,hope filled my soul,bfbarry
fellas hangin' out,be my homosexual,just don't tell my wife,bfbarry
googling symptoms,turns computer off pours wine,no cure for the blues,bfbarry
gentle ocean tide,the ripple traveled all span,it has reached it's end,bfbarry
shes an outdoor cat,reminiscing her fifth life,illuminous moon,bfbarry
defenses are high,positions deeply entrenched,fighting with my boss,bfbarry
she makes that cough like,pirates on the horizon,already too late,bfbarry
clouds drop me their time,quarter to soaked in wet dreams,thanks for everything,bfbarry
window cracked open,hoping for fresh morning air,smells like skunk butt now,bfbarry
auttum leaves,sigh of relief,be free with me,bfbarry
dead men sing no songs,but smart conspirators know,silence is a note,bfbarry
a son of lightning,roots run deep beneath my feet,petals bleached clear white,bfbarry
life is still quite sweet,even in times of sadness,let me breathe again,bfbarry
is it possible,to distill out the spaces,and leave just the time,bfbarry
holes in the wall now,where pretty things used to be,you are still with me,bfbarry
my happiness is complet,what on earth one more,mustache whisker inhaled,bfbarry
tiptoeing softly,to lay down near the fire,its old bones now warm,bfbarry
just as gray clouds burst,and light rains whisper downward,i yawn contently,bfbarry
its windy again this morning,and everyone i know,will fucking die,bfbarry
pushed out of the nest,now realizing that i can fly,thank you for leaving,bfbarry
the weekend was packed,now back to work tomorrow,my life has not slowed,bfbarry
in the neighborhood,signs divide the red and blue,will this ever end,bfbarry
fighting a typhoon,relentless i press on but,i can't stand the rain,bfbarry
this haiku was born,while huckleberry gummies,swam in my belly,bfbarry
have not been outside,since early february,summer days please stay,bfbarry
a flower blossoms,uncurls its naked petals,pours in the sun crunch,bfbarry
paycheck spent on snacks,a belly full of dismay,sweats like fat elvis,bfbarry
let's get lost tonight,escape the world and we'll find,home in each other,bfbarry
i should have proposed,you look stunning in your gown,always be happy,bfbarry
this still feels like home,i have been gone for nine years,time to leave again,bfbarry
knock knock on the door,little monsters with blue claws,digging for candy,bfbarry
oil sizzles in the pan,content the stomach rumbles,what joy good food is,bfbarry
morose until i,make my soul sing a song back,will you forget me,bfbarry
scurry lurking bird,this sugar is not your life,do not be tempted,bfbarry
worn faded and stained,the rag dries the artist's brush,it lives its purpose,bfbarry
full journal pages,flipped to cover yesterday,where do the days go,bfbarry
you just lost your job,have you friend ever been fired,from your family,bfbarry
pulling from the front,a fresh toilet paper roll,later from the rear,bfbarry
a single note plays,the tune linked with piano,push the middle c,bfbarry
burning unread words,flame consumes your memory,fiercer than our late love,bfbarry
withering slowly,life paints me with broad brushes,a dead leaf tumbling,bfbarry
i believe in me,yet i stand in my own way,i will carry on,bfbarry
a landscape pastiche,smears of blue green and yellow,monet dreamed for me,bfbarry
coins shook from her hair,in a midas touch with the,leaves changing to gold,bfbarry
mountain range of clouds,makes the sunrise last longer,gold crown at its peak,bfbarry
why is it that death,will only lend what life is,compelled to borrow,bfbarry
fatherhood issues,peed out diaper late at night,have another drink,bfbarry
social networking,a soapbox for everyone,can we survive it,bfbarry
my head is burnt out,with all this context switching,try again later,bfbarry
never connected,nothing makes one feel alone,like that admission,bfbarry
dancing in the rain,soaked but feeling joyful,i love this moment,bfbarry
winter's breath so cold,numbing fingers inside gloves,and ears under hats,bfbarry
am i getting one,asked a man in nantucket,or just giving one,bfbarry
got a new hoopty,cruising so phat down the block,how much were those rims,bfbarry
holding on too long,is just fear of letting go,i can't release you,bfbarry
the writing removed,no body bags to be seen,death of the haiku,bfbarry
facing my demons,spiritual redemption,freedom to be me,bfbarry
be kind to yourself,not just in the present but,past and future too,bfbarry
perfect is the son,perfection of me his will,praise you lord jesus,bfbarry
my glass is empty,the bathroom tap will not do,kitchen tastes better,bfbarry
the shine of the moon,and the glimmer of the stars,damn mortality,bfbarry
the words that i use,have been structured to form a,haiku poem,bfbarry
haiku is an art,painting landscape dreams of gold,for minds to behold,bfbarry
message read loud clear,words embrace repulse hard work,in these jobless times,bfbarry
until the sunrise,moonlit trails ride the ridge line,until the sunrise,bfbarry
this was a pit stop,a temporary refuge,you were good to me,bfbarry
left out and denied,never really liked it here,bound to be alone,bfbarry
say haiku out loud,doesn't it sound like a sneeze,haiku gesundheit,bfbarry
wound healednow returned,will i be rid of it lord,trusting in our love,bfbarry
oppressive july,smothering sweaty sleepers,distant thunder mocks,bfbarry
if this peace is real,let me collect my thoughts quick,then all life is fake,bfbarry
i love you she says,resting her hand on his heart,afraid he'll wake up,bfbarry
i couldn't fix you,i had no choice but to run,your demons followed,bfbarry
here i lie awake,wanting to sleep and thinking,of sleep sweet sweet sleep,bfbarry
gentle rain falling,the roof sings it's soothing song,sleep comes easily,bfbarry
i was plummeting,with no parachute no end,but you gave me one,bfbarry
i feel so carefree,though i am riddled with doubt,a puzzle unsolved,bfbarry
growth for the sake of,growth is ideology,of the cancer cell,bfbarry
knew the night was off,hand after hand confirmed this,folded then i left,bfbarry
please pick up the poop,made a good impression then,flung it off the trail,bfbarry
songs ever calling,such are the world's temptations,silence needed lord,bfbarry
the old creaky barn,that once raised a family,is full of spiders,bfbarry
insulated cold,there is nothing here but cold,encapsulated,bfbarry
i just bought a duck,not kidding his name's richard,he is fucking cute,bfbarry
american shores,while canadian neighbors,brood on beaver lodge,bfbarry
if you don't know what,to do with yourself then do,something for a friend,bfbarry
standing on the wall,watching the frost ice and snow,winter is coming,bfbarry
time heals is that true,gears motionless as i watch,the seconds rewind,bfbarry
sometimes we fall down,sometimes we pick others up,sometimes we move on,bfbarry
summer betrayal,the cold shoulder of autumn,with jackets for june,bfbarry
repeat after me,freedom is not found like this,freedom is not found,bfbarry
left or right click now,left click unless specified,left or right click now,bfbarry
don't make seas out of,rivers lost in the hourglass,though hardships we face,bfbarry
blue jeans sunlight air,warm today and i miss you,we'll breathe moonlight soon,bfbarry
acorn drops from tree,but trees can not produce corn,i am amaized,bfbarry
the olive branch wakes,no good deed goes unpunished,frost covers its buds,bfbarry
bad news from every side,depression lurks in the dark,a silent battle,bfbarry
wishing life away,now near the end of my life,let me start again,bfbarry
successful con man,still playing by their rules bro,smiles then drive away,bfbarry
autumn winds arrive,parading through the tree tops,leaf by leaf applause,bfbarry
in the dead of winter,sleepwalk on my balcony,cold feet in my bed,bfbarry
staring he stares back,wonders how he became me,then brushes his teeth,bfbarry
the texas cliche,doesn't fit in the garage,my new manivan,bfbarry
i miss your presence,all these memories you left,fill me with longing,bfbarry
falling apart now,holding myself together,faster said than done,bfbarry
fish and honeybees,see how they are related,butterfly effect,bfbarry
second vodka in,twilight zone of consciousness,my reality,bfbarry
floating in stasis,suspended animation,ready to resume,bfbarry
welcome to the void,drift into black nothingness,time and space dissolved,bfbarry
better hard to love,than easy to abandon,brutal poetry,bfbarry
frost on the blood moon,hidden beauty in the sky,her cheek against mine,bfbarry
van gogh's frightening,clarity was the least he,could say of nature,bfbarry
ironically so,it is solely beside death,can there exist life,bfbarry
summertime rain,dusting off muddy tulips,brand new yellow dress,bfbarry
if you introspect,you may recall your actions,discard assumptions,bfbarry
the people i knew,whatever happened to them,do they think of me,bfbarry
home a quiet house,jigsaw pieces fit nicely,sipping my earl gray,bfbarry
past the coral reefs,disguised on the ocean floor,an octopus waits,bfbarry
believing in what,birds empty hands sisyphus,my toes in the grass,bfbarry
hanging on to stars,even tho their light has died,a canyon of screams,bfbarry
hey up high he says,slap now go down low this time,too slow betrayal,bfbarry
sights sounds smells routines,comfort but i choose to leave,may i do your will,bfbarry
i found my purpose,inside the written words of,my innermost self,bfbarry
there is never enough time,to appreciate,a good burrito,bfbarry
pause for effect,respect for your weaknesses,some words of wisdom,bfbarry
fears of your future,become the ghosts of your past,friendly little ghosts,bfbarry
you can't ask for life,existance forced upon you,it's not free or fair,bfbarry
life ambidextrous,countin money in my right,slang white by left wrist,bfbarry
my work kills my soul,why oh why am i here late,come on lucky numbers,bfbarry
butthole eye puckers,takes one last cigarette drag,incorrigible,bfbarry
crinkling wrapper,dog instantly in kitchen,hope springs eternal,bfbarry
when shall spring arrive,winter stays unwelcomed here,smothering all warmth,bfbarry
so insane lives lost,tears flow hope in mercy love,lord heal our deep wounds,bfbarry
busy bee busy,buzzing between blooming bulbs,burden but bounty,bfbarry
watching the leaves fall,waiting for the first snowfall,wishing for summer,bfbarry
the falling rain stops,in its passing memory,reflection of sky,bfbarry
the water submits,victory without defeat,beautiful laughter,bfbarry
good night good night all,parting my way to sorrow,til it be morrow,bfbarry
sweet sharp saudade,the hair ties lie silently,my furry best friend,bfbarry
three in the morning,i'm up reading strange comments,reddit lullaby,bfbarry
was wishing today,was tomorrow and sorrow,had wings and would fly,bfbarry
keep your trash and change,in the same pocket for they,are one and the same,bfbarry
campfire set aglow,embers soar past moon soaked pines,dusk cricket's opus,bfbarry
down these wooden steps,leaves crunch under dusty boots,steep this hiking trail,bfbarry
how can a movie,about sex and bondage,be so damn boring,bfbarry
the big bang,unfinished pattern still unfolds,illusion of freedom,bfbarry
the wind writes poems,scrawls curving brushstrokes of snow,and reads them aloud,bfbarry
no taco today,mondays will not be the same,broken paradigm,bfbarry
sleep is resourceful,she turns tables to pillows,during maths exams,bfbarry
she paints my skies blue,she is my sun and my moon,she's my everything,bfbarry
warm star wakes early,gentle breeze tickles the grass,birds chirp reverie,bfbarry
your joy warmed my heart,prayers answered once again,humbly i give thanks,bfbarry
adrift between states,diesel cuts through mountain air,spark drag breath home,bfbarry
fear can cripple you,prevent you from advancing,proceed anyway,bfbarry
my love for you is,like the waves in the ocean,deeply eternal,bfbarry
each night he enters,each night he plays the same song,each night a nightmare,bfbarry
creating something,not sure what yet still so new,but i will create,bfbarry
that last episode,gave me more faith in mankind,great writing westworld,bfbarry
be free and let go,to realize you are human,you will make mistakes,bfbarry
scurrying nurses,evacuate larvae when,he stepped on their roof,bfbarry
we must embrace change,because it is the only,certainty we have,bfbarry
across an ocean,where the clouds meets the water,the horizon waits,bfbarry
betrayal burns the most,hearts of those who trusted wrong,scraping away hope,bfbarry
i ate the corner,chocolatey as it was,the party pooper,bfbarry
my bones shatter,my energy leaves me,ache and break,bfbarry
uniquely special,completely one of a kind,individual,bfbarry
what is there to do,other than sit around and,eat food eat food eat,bfbarry
he looks familiar,a slow smile spreads on my lips,my lover is back,bfbarry
wise men pick battles,the winds pick seeds and cotton,laying on the ground,bfbarry
leaves that were once green,slowly fade into orange,cold wind chill the air,bfbarry
we found each other,in a rapid eye movement,reality gone,bfbarry
it was falling hard,when i stood in a purple coat,watching the cement drown,bfbarry
the yews are sulking,snow tipped and bent to the ground,my life is exposed,bfbarry
worriesi have them,worriestrusting in god's grace,worriesdissolving,bfbarry
today i'm with you,tomorrow i am not sure,no regrets that's life,bfbarry
bird feeder reflects,sunlight between passing clouds,flitting wings shadows,bfbarry
childhood fadingtears,love i offer for these days,never will it fade,bfbarry
for a moment there,i believed this was true love,oh you thought the same,bfbarry
solifuges shrink,into lizards in ancient,smashing black zeroes,bfbarry
time is as humbling,as the wound we left to heal,a blood soaked bandage,bfbarry
the light from our star,reflections of a bright night,light from our moonlight,bfbarry
crowning his head with,vanity and beguile had,also crucified,bfbarry
want to make mistakes,and burn down the orphanage,and wake up sorry,bfbarry
froze to the core,shifting breaking ever more,broken ever more,bfbarry
creeping discomfort,when i'm not without,unmanaged feelings,bfbarry
i want to believe,in thelma to my louise,or laverne shirley,bfbarry
a gentleman swung,his steel arm in courtesy,to his pivot bridge,bfbarry
oh zero zero,how negative that is,pee stain on my jeans,bfbarry
transient flowers,beauty trapped permanently,never to wither,bfbarry
that worried old man,waits by his empty mailbox,for something for snow,bfbarry
testing spoiler text,this may be deleted soon,wasting precious time,bfbarry
we're already much more,than casual or small time,baby this is it,bfbarry
even though i miss you,i find myself crying less,bittersweet emptiness,bfbarry
midnight summer breeze,cup of tea  so serene,a simple life  i smile,bfbarry
journal life daily,distraction or otherwise,unforgettable,bfbarry
i'm ready for bed,she told me as she hung up,she didn't mean mine,bfbarry
what is a raindrop,but a single metaphor,for my fall to earth,bfbarry
and in the mourning,i hear the echos of quacks,you have left for me,bfbarry
hell yeah i work out,i run from all my problems,why am i not thin,bfbarry
