line1,line2,line3,source
lessons from the sun,cast your light as wide as earth,always rise again,bfbarry
i lookedthere you were,ever have we loved such joy,us forevermore,bfbarry
cups by the window,always fuller than the cups,stored in the cupboard,bfbarry
two broken people,counting down the days gone by,forever it seems,bfbarry
to oi no sora,kimi no omoi yoou ni,mou ichi do aitai,bfbarry
i am curious,yellow blue socialism,politics or porn,bfbarry
are you a wild,orchid kept hidden from view,no one saw you bloom,bfbarry
you are not a rose,you are the thorns beside it,constant pricks and pain,bfbarry
dipping my fingers,plucking ice cubes from water,hand across my brow,bfbarry
a weekly shower,cologne to hide his foul stank,but he's on day nine,bfbarry
misery detached,move from point a to point b,a humble learning,bfbarry
a lingering hug,one so tight the world makes sense,i need one today,bfbarry
hair exudes amber,slowly encouraging him,to love pain she brings,bfbarry
baby in warp speed,his fat tummy points ahead,his limbs flail behind,bfbarry
pray for your healing,confident of god's answer,perfect is his love,bfbarry
which do you want more,the pain of staying the same,or the pain of growth,bfbarry
infidelity,nights when you say i love you,all lies and deceit,bfbarry
downvotes 'o plenty,if your haiku has curse words,those are the best ones,bfbarry
dream stalker,polaroid prey,spread the word,bfbarry
tears roll down my face,i will never understand,is there more to life,bfbarry
i know you're still scared,we have so much to lose,i too am afraid,bfbarry
unmotivated,unheard unsure unnoticed,not undeserving,bfbarry
freedom is a whole,cannot be picked and chosen,remove one take all,bfbarry
poppies are blooming,petals cradled by the stream,silent confession,bfbarry
hands shaking,her stare hypnotizing me,lips forming a smile,bfbarry
unachievable,will i ever escape my mind,i tire but never quit,bfbarry
like the spring blossom,i to occasionally,fall gracefully down,bfbarry
always listening,keep the focus off of you,and how are you fuck,bfbarry
drop of grey dissolves,in our sea of yesterdays,another today,bfbarry
a conversation,we had between the daisies,what do the stars mean,bfbarry
the blue spruce fiat,invited a little bird,to nest in her bough,bfbarry
love is hard as hell,love is an anomaly,love is wonderful,bfbarry
last summer's wind chime,dings its two remaining notes,at cold april rain,bfbarry
there is hollowness,an empty space the dark void,stormy loneliness,bfbarry
your love is water,my heart awaits underground,to bloom toward you,bfbarry
write live eulogies,for the ones you love the most,and tell them your heart,bfbarry
you made all the sounds,and i painted their colours,i chose the wrong shades,bfbarry
clouds part revealing,a single ray of sunshine,right into my eye,bfbarry
she critics herself,harshly and without reason,to me shes perfect,bfbarry
few more years perhaps,ghost of halls i barely see,then at once revealed,bfbarry
a new source of light,gives me new environments,to admire you in,bfbarry
my loneliness is,trying to kill me but i,won't lie down and die,bfbarry
pandemic wedding,thirty people in a tent,forgetting it all,bfbarry
the bright sun sets far,further than the stars and skies,even birds can't spy,bfbarry
slicing of the cake,celebration of life,i love you grandma,bfbarry
empty sky the tree,outside my window fell down,i miss you my friend,bfbarry
one hundred bugs,crawling around everywhere,theyre on my face help,bfbarry
ha ha ha ha ha,that's the way the joker laughs,so batman beware,bfbarry
white lines and black heat,carpark trudging fucking sucks,yeah nice existence,bfbarry
stuck in the starship,slimed eyes teeth wildly clacking,the plagued have found us,bfbarry
i shaved my beard off,now i've lost a part of me,and i'm still ugly,bfbarry
did i serve you well,with god all is possible,pray with me today,bfbarry
fragrant milky blooms,swift sojourn of my heartbeats,wreckage amply trimmed,bfbarry
zoning out in class,my brain cannot stay focused,i will fail my test,bfbarry
a cold milky fog,clings to glass and land and fuel,a dad clings his girl,bfbarry
what is the point of,fighting with the older folks,they're likely senile,bfbarry
a broken mind,with the right tools to fix it,lacks experience,bfbarry
a gentle wind blown,across a rolling ocean,the cloud breaks sunlight,bfbarry
a frame of mind,walking the perimeter,waiting for a break,bfbarry
she feeds me life force,i love her so much that i,wish she never met me,bfbarry
an owl calls out,fear of the forest grips me,home feels far away,bfbarry
their saturday bath,had left a ring of dirt and,some floating feathers,bfbarry
need help with writing,english speaker cannot count,syllable numbers,bfbarry
my heart cries for you,and you and that and silence,bereft and adrift,bfbarry
we were no more blind,to the depth of that darkness,darkness uttermost,bfbarry
kneel to your maker,he is the almighty one,do not beg or plead,bfbarry
it has been undone,a single night of coldness came,leaving sprouts all brown,bfbarry
kibble to nibble,dry hard shapes of fish and cheese,more meow mix please,bfbarry
sunset lights,trace the hilltops,and paint their edges red,bfbarry
blush and billowy,you take me to ecstasy,oh my labia,bfbarry
the beauty queen spring,with no one around to see,grows irritable,bfbarry
leaning on a log,a manifest cannot lie,an unwelcome cut,bfbarry
embroidered wool scarf,crafted with such intricacies,longing to be worn,bfbarry
life moves with no pause,like the flow of the river,i just keep swimming,bfbarry
alberto blew through,washing out the laneagain,a toads holiday,bfbarry
my research has shown,that cookies are the best food,it's not even close,bfbarry
seagulls ride thermals,high enough to be unseen,faint swath of cloud,bfbarry
saw a wren today,just a momentary glimpse,cute little loud bird,bfbarry
rippled glass trembling,a dragon breathes forth a chill,leaves scumbled beneath,bfbarry
winter snow fresher,suddenly feces of dogs,totally vanished,bfbarry
limes lollygag,unless used soon they'll spoil,moldy fruit new life,bfbarry
a man paints his nails,the fear of mens' judgment ends,with a friend's support,bfbarry
early at morning,my alarm calls me to work,should i quit or go,bfbarry
zooming in the car,too much damn noise in the house,dog keeps on barking,bfbarry
i once had a friend,he was imaginary,disappointing right,bfbarry
cheese is much splendid,cheddar swiss provolone yum,put it on a bred,bfbarry
snapping her gum was,a splintering of spines which,popped on the transit,bfbarry
most guys who dislike,the way fake breast implants feel,have never felt them,bfbarry
one day i will leave my room,fulfill all my dreams,maybe tomorrow,bfbarry
do the footprints show,only where i am going,or where i have been,bfbarry
words in any order,possibilities in lines,haiku therapy,bfbarry
when we were still young,before the net ensnared us,days were long and free,bfbarry
im done telling lies,time to be a better man,pinocchio's nose grew,bfbarry
i wake in the night,stretch roll over reach out and,hug your cold pillow,bfbarry
last light of the day,the sky so full of colours,peacefulness inside,bfbarry
quick call the police,the peasants are revolting,and not just the smell,bfbarry
sing to me my sweet,dress your infidelity,such beautiful lies,bfbarry
sex equality,it has to be the same rule,for everyone of us,bfbarry
we are like snowballs,years passed layered to our core,our cores never melt,bfbarry
morning light washed field,young viridian dew glows,appaloosa wild,bfbarry
violence is an art,your body,the louvre,bfbarry
i never meant to,my mind is tormented and was,never meant to love,bfbarry
rolling a steel ring,on my fingers helps me think,keeping the pattern,bfbarry
complete confidence,power so overwhelming,take on anything,bfbarry
you are my whole world,shining star that guides me home,across the vacuum,bfbarry
lets cross the whole world,in parallel lines like the,shadows that abstain,bfbarry
clouds rain and sun shines,rain means sorrow sun means joy,today joyful rain,bfbarry
struck by evilwhy,love given hate receivedwhy,do not be afraid,bfbarry
fire ant bites hurt,i explained to the jolly,exterminator,bfbarry
i prime my mind,and the focus brings gifts,of excellent haikus,bfbarry
a brush of my face,rays cast by the clear blue sky,cool air fills my lungs,bfbarry
celestial souls,dancing bodies are entwined,spiraling apart,bfbarry
distant times to come,cloudy skies and under earth,our end is ensured,bfbarry
my date stood me up,i should be mad but i'm not,i don't even care,bfbarry
smoke parts,in the search of,a critique partner,bfbarry
you pull me back in,now these confused emotions,will be my death march,bfbarry
from birth she smiles,always playful always there,in the end we die,bfbarry
two drunks get hammered,they lead each other to doom,can either be blamed,bfbarry
sisätiloissa,kellot vain tikittävät,iän tuomat läikät,bfbarry
you offer samples,of foods you haven't tasted,practice what you preach,bfbarry
arboreal arch,bare branches pay homage to,the frozen sky god,bfbarry
my lonely shadow,spreads his body on the walls,and the room combusts,bfbarry
i do not know what,is shaking my soul the most,to miss you miss out,bfbarry
please don't ban me no,i have done no wrong you know,nigger nigger nig,bfbarry
as i lay awake,fingers taping syllables,a haiku is born,bfbarry
sun rise time to delve,tip toe through bustling streets,liberty renewed,bfbarry
over under grip,a gasp for air,fatality,bfbarry
pentasyllabic,is coincidentally,pentasyllabic,bfbarry
my balls are bulging,swollen up with sticky cum,size of a balloon,bfbarry
one day i saw it,the ghost of me standing there,my reflection,bfbarry
five neighbors gather,tightly in a fleshy ball,a swing and a punch,bfbarry
temptation within,a rising tiger ready,rise to occasion,bfbarry
writing every day,my odes have lost their meaning,yet i write again,bfbarry
the city bankers,watch as the tattered beggar,points at them and laughs,bfbarry
you don't need to speak,i know how to read by now,twinkles in blue eyes,bfbarry
why is there no spark,when i have all the matches,they must be burnt out,bfbarry
schwarma for dinner,chips chicken and a fanta,i hate my dull job,bfbarry
in this marathon,there were no shoes only sheets,rest is needed now,bfbarry
people want to talk,issues topics  are you foe,family or friend,bfbarry
dungeons and dragons,reality fades away,my friends and i play,bfbarry
bleed encouragement,satan in the waiting room,weep in the stretcher,bfbarry
so many options,an easy way out for sure,just hard to fit through,bfbarry
just outside of town,on a dark and lonely road,lost and found of life,bfbarry
i am the reaper,without me the world would rot,still they want me gone,bfbarry
fields of bright colours,tulips daffodils hyacinths,holland in april,bfbarry
the bulrush curtsy,in the wake of the lagoon,while the houses sleep,bfbarry
i know now why did,dinosaurs become extinct,please wash your hands often,bfbarry
the change desired,will remain a fantasy,if not for action,bfbarry
my first recession,retail stores furlough thousands,glad i own no stock,bfbarry
sea and salt and stone,caress me raw and screaming,loving me to death,bfbarry
growing starvation,a willy in the white house,enjoying the game,bfbarry
cutting and frying,onions based meat melodies,while the veggies soar,bfbarry
hi there philip glass,please can you play the same thing,again and again,bfbarry
the lewd attire is,envious of loveliness,wearing modesty,bfbarry
her garden flourished,in the flowering plate ware,dug up from yard sales,bfbarry
through deep black,dim moonlight on snow,outlines the branches,bfbarry
sometimes some things rhyme,other times they just dont try,this is one such time,bfbarry
death acts life reacts,spend time turning looking back,memories along the track,bfbarry
moralless orange,souring things all around,can we just squeeze him,bfbarry
lips turn up forced smile,what other choice did i have,i am fine thank you,bfbarry
i speak to the stars,about my deepest secrets,when will they speak back,bfbarry
do not give new names,to historic and sacred,pilgrim remember,bfbarry
motes drift unseen,sunlight seeps through,boarded up windows,bfbarry
you wake up alone,go throughout your day alone,fall asleep alone,bfbarry
we met in the spring,fell in love in the summer,and died in winter,bfbarry
halloween retreats,christmas on the horizon,but first thanksgiving,bfbarry
racial policy,purity über alles,just common sense folks,bfbarry
cold winter fingers,wrapped in a down comforter,sleep creeps through the house,bfbarry
spring games with the moon,playing hide and seek all night,i've never won once,bfbarry
motörhead kicks ass,girl love me like a reptile,the hammers comin',bfbarry
now orange embraced,forgotten are scenes of green,sweetly sour serene,bfbarry
a new fruit dangling,precious food not yet formed,will it persevere,bfbarry
starbuck are racists,people are too sensitive,make mine a latte,bfbarry
a song of sorrow,yet promises a great truth,twenty one pilots,bfbarry
i see the ice is,slowly melting here comes the,sun and it's all right,bfbarry
spirits of my past,ink'd across my page of life,a tattoo of guilt,bfbarry
pet insecticide,cat chases roach  round the room,that bug met his doom,bfbarry
the weekend is here,now is the time to relax,oh wait it's monday,bfbarry
from out of the woods,a young dog seeks his master,are we not both lost,bfbarry
the wind on my face,thoughts of what it may carry,holding my breath,bfbarry
i want you to know,i miss our time together,those fleeting moments,bfbarry
dashing through the snow,ho ho ho he yells aloud,fat drunk homeless man,bfbarry
a mother struggles,in silence she pleas for help,but silence she finds,bfbarry
eating taco bell,i will punish my toilet,no regrets today,bfbarry
the sweet springtime sunshine,twinkles down through the leaves onto,our smiling faces,bfbarry
up the interstate,a plunge to make your skin blue,home before midnight,bfbarry
slowly at first glance,then suddenly all at once,like the sunrise love,bfbarry
the first amendment,does not apply to hate speech,unless you hate trump,bfbarry
what part of my gift,is the uplifting of my,dull and drowsy eyes,bfbarry
a walk in sunshine,side by sideyour presencejoy,sweet recollections,bfbarry
snow goes wherever,the wind says wind says to go,north the snow goes south,bfbarry
crazy in this cell,should i be scared of my voice,or just the echo,bfbarry
mind stuck in the clouds,shy and lonely as i breathe,forever alone,bfbarry
we both saw the spark,a chance to make light for us,but the darkness stayed,bfbarry
over indulgence,wincing at patchy flashbacks,fuck i do that for,bfbarry
the sad truth of life,all that is good is fleeting,we are slaves to time,bfbarry
i miss you so much,it's so hard without you here,papi please come back,bfbarry
ville and the girl,summer sun flapping curtain,she can never stay,bfbarry
visiting this place,memories are tangible,i still see your face,bfbarry
a walk down waikiki,even the chickadees here,give tourists a show,bfbarry
tears form in my eyes,you touch all the right places,while i beg please don't,bfbarry
bustling white sidewalks,displaced coyotes howl,slink through midnight streets,bfbarry
a rope is hanging,swaying what shoul i do hmm,maybe just maybe,bfbarry
sunshine on my face,words and chords in melody,a rare breath of life,bfbarry
celebrate the day,of a roman's beheading,by sending candy,bfbarry
picketing a saint,with signs of the cross and a,novena of prayer,bfbarry
lessons learned again,wisdom to grow more more more,an ultimate form,bfbarry
a haiku collab,writeabadhaikucom,hope you enjoy it,bfbarry
cold pale and numb toes,painful walk to the dryer,full of single socks,bfbarry
one chance to explain,and the monster you run from,will quickly be slain,bfbarry
fire in each motion,wasting away so slowly,rage is what is left,bfbarry
two bit deceivers,pour out their twisted hearts,their love is broken,bfbarry
my life of service,in my bucket love of you,praise to god each day,bfbarry
towards light we wander,seeking and always circling,dreaming our moth dreams,bfbarry
his balls were dangling,like the golden apples of,the eternal tree,bfbarry
i see your eyes shine,does your mouth smile wide for me,o to laugh with you,bfbarry
mistakesdon't look back,learn from them change grow and love,how can i serve you,bfbarry
some say love is true,some say love is all you need,i just want a glimpse,bfbarry
hollow hulled and lost,you freeze frame in my clear mind,forever strolling out,bfbarry
scrap of white paper,soft words crumpled and tossed away,summer rain begins,bfbarry
two big empty hearts,a good day to stay in bed,a room filled with us,bfbarry
at the age,of little boy,the big moon,bfbarry
the roots of tall trees,rise up from the earthen floor,reclaiming their home,bfbarry
the autumn wind blows,her face numb and heart broken,he never showed up,bfbarry
face in your pillow,it once meant something to you,now it's just for rent,bfbarry
ironically,the best and worst thing about,you was your damned mouth,bfbarry
i came to know you,but only biblically,not how it matters,bfbarry
mandalorian,baby yoda is so cute,thanks jon favereau,bfbarry
far away in bold,desire quenching thirst in spring,reckless autumn comes,bfbarry
shut up mama gump,it's more like tv channels,not chocolate boxes,bfbarry
the cold wind blows hard,against a weak little plant,uprooting it all,bfbarry
let the vengeful sky,loose silver arrows of rain,on my umbrella,bfbarry
cold covered in snow,my heart slows for a moment,until i see you,bfbarry
dry leaves descending,settling gently on the earth,crumbling into dust,bfbarry
don't worry you'll say,that is how it always ends,like i know it will,bfbarry
tattered plastic bag,ribboned across barbed wire,anger carves up skin,bfbarry
poured my heart onto a page,an ocean of thought,two droplets deep it drowned,bfbarry
a botched waste of time,days sink like stones in water,muted clock hands wane,bfbarry
another whiskey,darkness calm cool soothing grip,never waking up,bfbarry
thousand miles apart,two souls searched for a meaning,they found each other,bfbarry
feel empty in gut,revolving days go away,stuck in a deep rut,bfbarry
hours drift downstream,i chase them daily but fall,into tommorow,bfbarry
the groundhog had not,seen his mischievous shadow,why is it snowing,bfbarry
often we have loved,ever bound body spirit,journey united,bfbarry
the light flickers low,there is no night for these dreams,or bed to sleep in,bfbarry
reforging a sword,that comes back like a nature,after every war,bfbarry
a god shakes his head,a child cries for his mother,still just as empty,bfbarry
the blackbird calls out,his soft song gentle and sad,he is calling her,bfbarry
watercolor lights,illume the sleeping city,as whippoorwills mourn,bfbarry
to kindergarten,i googled the difference,between duck and goose,bfbarry
she is the night time,it is there no matter what,the moon makes me happy,bfbarry
i love you so much,that i would enjoy burning,just to be your light,bfbarry
someone called the cops,so they all got off the bus,wonder what they did,bfbarry
my heart overflows,a babbling brook of sorrow,though tears stream faster,bfbarry
me myself and i,what the fuck do i do now,get a second job,bfbarry
i am just a leaf,and history a river,carry me a while,bfbarry
country boy dirt road,silhouetted trees dusk sky,sunset glows sunroof,bfbarry
black hood on my head,broken rules and soft crying,death of the haiku,bfbarry
talkin' 'bout big mike,patrick ewing in a dress,michelle obama,bfbarry
loneliness is what,you put in your coffee now,to keep you going later,bfbarry
we can only hope,that a dark reddit ui,will brighten the mood,bfbarry
the shy pink blossom,her colours show what could be,lighthouse of beauty,bfbarry
night skies are a bloom,aurora borealis,happiness above,bfbarry
anger leading you,prayer given up for you,on my knees this day,bfbarry
i carry around,a box of melancholy,it gets out sometimes,bfbarry
imminent failure,the world is spiraling down,the same way i am,bfbarry
what is there to lose,tell the ones you want to love,or risk silence,bfbarry
facts truths and wisdom,soundbites headlines and boredom,where is my compass,bfbarry
together at last,the earth no longer holds my soul,as it once did yours,bfbarry
i can't handle this,take all of my broken tears,my heart can't take this,bfbarry
tremble at your touch,this unbearable feeling,ecstatic release,bfbarry
it's nearly five,in need of her husband,stricken by sickness,bfbarry
past is history,present is what we make of,unwritten future,bfbarry
brown curls wild and free,he roars under the hot sun,king of the playground,bfbarry
buff buffalo buff,buffalo buff buffalo,buff buff buffalo,bfbarry
i'm writing again,after eight long years of doubt,caused by a teacher,bfbarry
surprised and challenged,my plans interrupted now,praying for wisdom,bfbarry
murmur of the brook,drowns out the sounds of highways,once your feet get wet,bfbarry
paralyzed my mind,asked my brain yet heard my heart,sucker for those eyes,bfbarry
two amputations,no insurance it cost me,an arm and a leg,bfbarry
heart filled singing,filled my soul with love,penetrated endured enjoyed,bfbarry
yesterday revealed,bones under my flowerbed,today they have bloomed,bfbarry
ungrateful spirits,rebel freely to their end,my lord please break me,bfbarry
she meets him at night,and he hikes up her plaid skirt,fireflies dance til dawn,bfbarry
hello mister cloud,perhaps you are a missus,please lend us some help,bfbarry
at the wishing well,yesterday you were crying,and today you smile,bfbarry
fame is a poison,created by a demand,to escape our lives,bfbarry
even the soft breeze,brings invisible peril,when will we be safe,bfbarry
a spark leads to fire,leads to passion and desire,forging trust and love,bfbarry
after the drive in,pouring rain they were stretching,and segmented home,bfbarry
astrological entity,illuminating my night,my beautiful moon,bfbarry
dark and oppressive,thunder echoing away,lightning clouds no rain,bfbarry
strange green oozing puss,boy this haiku is sure gross,good thing it's so short,bfbarry
i took out the trash,and left the confines of home,an exciting day,bfbarry
a slice and a cut,a terrible self hatred,washed away with tears,bfbarry
wake with a numb arm,feel as the blood flows back in,know that you're alive,bfbarry
i guess i like you,you can do wierd things to me,i guess i dont care,bfbarry
suicidal thoughts,drown it all out with vodka,swallow rinse repeat,bfbarry
the mirror's not wrong,white hair is mingling with black,i blinked and got old,bfbarry
cat smiling beguiling,sleepy indolent and fat,stretches for a scratch,bfbarry
what is now to do,no more sorrow to end it,fleeting pain i am,bfbarry
illumination,bright speech of the brave and just,read about in books,bfbarry
taking up a space,versus filling up a void,a world of difference,bfbarry
day and day and day,flows away in silver streams,moonbeams paint my way,bfbarry
depression filled eyes,forced smile to be polite,on camera all night,bfbarry
her eyes warm deep pools,i'm fearing i'll drown in them,a death worth dying,bfbarry
eyeing his stomach,i anticipated breaths,but they never came,bfbarry
the grim reaper shove,unyielding with sirens and,screaming through traffic,bfbarry
you say those sad words,now we are strangers again,i steal a last kiss,bfbarry
tired hands fumble,with the clasp of an old bra,elm tree groans at night,bfbarry
awake before dawn,i hear the city rising,the new day begins,bfbarry
one thing is for sure,epstein did not kill himself,we have been lied to,bfbarry
opened a seltzer,feeling strong disappointment,that it isn't beer,bfbarry
lying in bed,thor practicing carpentry,the sound of rain,bfbarry
wandering again,in a world full of puppets,who pulls on my strings,bfbarry
fresh air nature and,movement are the real saviours,in this life of mine,bfbarry
the voice of your soul,speaks loudest when listening,no pressure just love,bfbarry
begin transmission,houston we have a problem,we are not alone,bfbarry
please be prolific,trudge through bitter fog and noise,find resilience,bfbarry
outgrown legacy,when a rock star becomes gray,much love for the dead,bfbarry
batting a birdie,badminton for the kitty,served up the feathers,bfbarry
don't give reddit inc,money for what someone said,give it me instead,bfbarry
you're not up nor down,a backwards fucking magnet,you repel it all,bfbarry
i could kill you now,i won't spoil our little game,patiently i hunt,bfbarry
marilyn monroe,and john lennon too you know,were taken by foe,bfbarry
these words i plucked straight,from the indian summer,stirring in my breast,bfbarry
cats and dogs are cool,but so are spiders and snakes,don't discriminate,bfbarry
your lips are roses,kisses that leave me bleeding,with thorns in my teeth,bfbarry
what's your end game,what do you want just tell me,no don't i'm walking,bfbarry
sunset warms my face,summer breeze tangles your hair,our fingers entwined,bfbarry
no resting tonight,melancholy my visage,why are things this way,bfbarry
darkness beckons me,where is the light life and love,darkness becomes me,bfbarry
short skirt and high heels,a night full of adventure,mom's clothes fit him well,bfbarry
a beautiful day,speeding down the highway,a butterfly squashed,bfbarry
whim carries the child,weather rules the planted field,both open to chance,bfbarry
sunlight follows rain,green leaves sparkle with the drops,a tiny bonsai,bfbarry
my sin was so foul,my soul dropped straight into hell,now my shell wanders,bfbarry
a face in a crowd,big brother's eyes always see,'cuffed at a concert,bfbarry
hunger comes in waves,lucidity builds quickly,fasting brings me here,bfbarry
blue jays playing chase,in the skeletal tree tops,leaden sky says snow,bfbarry
eviscerated,your indifference cuts deeper,than any rage could,bfbarry
snow ribbons dancing,across frigid parking lot,beauty of winter,bfbarry
telling watchful eyes,abundance of consciousness,alone i laugh deep,bfbarry
