line1,line2,line3,source
the phone rang six times,hello she whispered still hoarse,only heard his breath,bfbarry
you make my knees weak,your passion swallows me whole,i give in to you,bfbarry
road curving ahead,considering my options,could keep going straight,bfbarry
wanna hear something,no listen no listen hey,i'm not obnoxious,bfbarry
on my side of town,the rain never seems to stop,even with no clouds,bfbarry
narrow wildcat streets,a trained specialist lurches,enjoying the spawn,bfbarry
treacherous mountain,euphoric and troublesome,new paramedic,bfbarry
i saw her face here,looking out over the sea,then i fell in love,bfbarry
time to say sorry,to pause before i react,renew everything,bfbarry
crisp bubbles rising,golden hues glimmering bright,the smell of fresh hops,bfbarry
here comes our bright star,we are waiting for its light,fear it but fear not,bfbarry
cold ferocious winds,they break the silence of night,nature's warning voice,bfbarry
i broke that birdbath,for you because i knew how,much you hated it,bfbarry
decadent madness,i lie awake in the night,confounded by it,bfbarry
with the headphones on,he watch tongues flap in the wind,like archaic flags,bfbarry
you a wilted rose,strikingand in need of love,i shall be your sun,bfbarry
my palate transformed,scorched ships crashed on the sea shore,islay scotch whisky,bfbarry
mittens are mugging,a handle on skating with,floating marshmallows,bfbarry
early morning gym,sweating pushing breathing hard,what the utter fuck,bfbarry
a happy bottom,reaches high into the air,and lets out a fart,bfbarry
tan granules expand,to deep blue icy ripples,my sanctuary,bfbarry
past smiles in our wake,obliged to forlorn future,i languish betwixt,bfbarry
long i wait for god,i slip into oblivion,still i yearn for love,bfbarry
tear down lennon wall,those patriotic students,only wear supreme,bfbarry
the seconds tick by,every one a reminder,she never called back,bfbarry
the warmth of his skin,supple with each conscious touch,widens pleasantly,bfbarry
what it is to be,folded wings of a sparrow,an unpicked apple,bfbarry
i want to be yours,put your head on my shoulder,tell me you love me,bfbarry
there's nothing sweeter,than having the taste of you,stained upon my lips,bfbarry
dry country prevails,the drought years of history,threaten to return,bfbarry
happy drinkers crowd,autumn european streets,carelessly strolling,bfbarry
i am so damn bored,i am so damn bored in fact,i wrote a haiku,bfbarry
democracy brings,a sucullent chinese meal,well how about that,bfbarry
insane is the out,not all cracks are an exit,but few in the brain,bfbarry
another hot day,walking along the river,sun also swimming,bfbarry
my face flushing red,dark thoughts are inside my head,want to see you dead,bfbarry
small bird on my lap,puffs up her yellow feathers,and shakes mightily,bfbarry
with the water still,the dock creaks under the weight,the ripples scatter,bfbarry
a bloody walker,footsteps on the white snow,owl turns around,bfbarry
foreign aromas,lake today tomorrow rain,i was younger then,bfbarry
weekend ends sideways,too much stress not enough rest,can't let the night go,bfbarry
have you tried turning,it on and off again like,i told you to do,bfbarry
boiling over,malcontent kentucky fall,breanna taylor,bfbarry
this whiskey makes me,long for your skin against mine,i cannot bear it,bfbarry
a flame in the rain,fought and flickered to its end,may yours not follow,bfbarry
at night in my room,collapsing in on myself,singularity,bfbarry
trotting in the yard,a whimpered search continues,no home for a bone,bfbarry
a boy lay up high,down the dry ground make him sad,for that he will cry,bfbarry
how the city lights,make us feel like this is life,and yet emptiness,bfbarry
the winter growing,i am like a bear snoring,with blanket coating,bfbarry
doves sing from the roof,through the chimney and fireplace,my winter chorus,bfbarry
i steal all our things,and lose them,kleptomaniac,bfbarry
squirrel in the tree,i watch anxiously all day,the grass on my belly,bfbarry
ice road,skates carve glaciers,near the grocery,bfbarry
skin so tan and taut,bang you till the break of dawn,love in every beat,bfbarry
first time kayak class,green and yellow maple leaves,wobble on the lake,bfbarry
chicago winter,l train rumbles overhead,snow falls silently,bfbarry
your eyes reflect skies,a surface of stars on skin,underneath the moon,bfbarry
big brother census,and soon the prying question,of our craps per day,bfbarry
it excited him,rubbing all over her skin,it's great to be soap,bfbarry
i'm stood up again,me a bench and a bouquet,of she loves me nots,bfbarry
chaos and order,one creating the other,now balance remains,bfbarry
stop ignoring me,i want to tell you something,i want my dick sucked,bfbarry
to sate all wishes,desires defined completely,content only then,bfbarry
your requestsurprised,with prayer i fulfilled it,guided by god's grace,bfbarry
there is so much to,remember that beautiful,forgotten moments,bfbarry
chin up little guy,fly towards that morning sun,the world waits for you,bfbarry
you taught me to be,strong independent and to,take shit from no one,bfbarry
appetizers done,craving the pièce de résistance,followed by dessert,bfbarry
each pieceperfect fit,living the moment with joy,why am i surprised,bfbarry
twinkling starlight,cold cosmic radiation,all becoming dust,bfbarry
damaged beyond help,i can't function normally,my brain is broken,bfbarry
a gentle crisp breeze,autumn embraces my face,seasons past linger,bfbarry
cool pool dip my feet,rivers running down my back,soaking up summer,bfbarry
i honestly thought,that i had no more chances,o how wrong i was,bfbarry
what did you order,i forgot what i wanted,what am i doing,bfbarry
a prayer answered,after steps walked in trust,striving forward again,bfbarry
rain tickles quiet lake,water arches to meet drops,new friends drowse in sun,bfbarry
friendship is a gift,souls enlighten each other,the divine oneness,bfbarry
jacksfilms is a god,the king of haikus himself,fore head is too big,bfbarry
to be quite honest,downvotes do hurt my feelings,they are real to me,bfbarry
counting syllables,twisting words into a poem,a feeling of calm,bfbarry
nagged for his smoking,but her slothfulness squeezes,heaven's narrow gate,bfbarry
the c in comely,if replaced by an h means,quite the opposite,bfbarry
your smile there is joy,your love piercing to my soul,my choicepass it on,bfbarry
when i'm far away,from the people who love me,i feel kind of free,bfbarry
the fights have begun,there is jealousy and games,all fun to the end,bfbarry
a ship in harbor,never realizing her dreams,is safe from the wind,bfbarry
when my eyes open,my heart sees you through my eyes,then it smiles brightly,bfbarry
make no mistake friend,the ghosts of your past are here,they shall consume you,bfbarry
plus carpeting is,placed in the nursery for,chickadees on moss,bfbarry
with this soul fire,hope for happiness becomes,just daydream shadows,bfbarry
thunder and lightning,our valley has now been cleared,tomorrow training,bfbarry
monet and van gogh,on exhibit umbrellas,in the new york rain,bfbarry
weeping willow,stands tall and alone,within a silent fog,bfbarry
i just feel alone,it is killing me inside,thanks for being here,bfbarry
you hear the call friend,will you answer surrender,do it love awaits,bfbarry
where am i going,everything just fucking sucks,get over yourself,bfbarry
slow am i to learn,thanks for your patience my lord,teach me love each day,bfbarry
bees bees bees bees bees,oh god they are everywhere,this is agony,bfbarry
born into this world,breathing until the last day,blessing of living,bfbarry
do not come home in,a highly drunken state with,loving on your mind,bfbarry
history time bro,japan's sixteenth century,hokku staked its claim,bfbarry
clouds in the chill full,moon breaks free catches my eye,together alone,bfbarry
look for the bright spots,they will light up your darkness,eventually,bfbarry
i have made you look,last sentence four syllables,i got you again,bfbarry
working on writing,here is a tiny haiku,please have a nice day,bfbarry
drive past shaded yews,sharp light turn my head to view,how did i get home,bfbarry
the cat loves to blaze,marijuana all day long,a high cat haiku,bfbarry
year resolutions,never meant to be followed,just for peace of mind,bfbarry
manual breathing,inhaling and exhaling,your heartbeat pumps blood,bfbarry
life in sardinia,a new world that awaits me,spritz and the blue sea,bfbarry
still i don't regret it,if that's what you want now fine,you've done all you can,bfbarry
here i am hanging,by an umbilical thread,from your vicious lies,bfbarry
it's the little things,that i wish you would notice,because i love you,bfbarry
just a bit prickly,i don't need that much water,i was still too much,bfbarry
the night sky winking,sleeping with one eye open,dreaming of daytime,bfbarry
thank you friend spider,you work enough for us both,lazy summer day,bfbarry
delicate snowflakes,accelerated by gusts,become ninja stars,bfbarry
on a bed of black,here stands the height of mankind,stolen from the camel,bfbarry
life gives offering,of painful lessons humbling,and so much beauty,bfbarry
do the loons cry out,of love or of loneliness,under this full moon,bfbarry
vigilant angels,still tender to their plots in,a carving of wings,bfbarry
what does it matter,everything is conjecture,no money no food,bfbarry
sometimes think of you,listening to the oldies,take care of our son,bfbarry
baubles tempting us,treasures within our grasp now,have we chosen well,bfbarry
lockdown is boring,but i'm allowed to exercise,today i cycle,bfbarry
goin on you with,the pick and roll your laflame,he in sicko mode,bfbarry
people ask for rain,does not mean you bring the storm,sometimes less is more,bfbarry
i'd just like to sleep,assume position close eyes,and think of nothing,bfbarry
take my warm blanket,a failure in every way,core as cold as ice,bfbarry
we breach the building,we breach the inner chambers,where will peace come from,bfbarry
lonely christmas day,soul crippling depression,love has abandoned,bfbarry
do not fake yourself,through acceptance of your faults,you can become free,bfbarry
we married in bloom,seasons came and went in breeze,and calm life passes,bfbarry
we get online clout,in an orange arrow form,poems thoughts and memes,bfbarry
insides are broken,ate too much peanut butter,reader please send help,bfbarry
gone but remembered,time was but an unknown gift,we cry out for more,bfbarry
vanquishing demons,achieving inner balance,let the bad stuff go,bfbarry
a thin pane of glass,protects me from icy wind,who is more fragile,bfbarry
finger my six strings,build up to a crescendo,while i gently weep,bfbarry
most haikus are just,run on sentences that need,more punctuation,bfbarry
friday bored at work,just a typical weekday,almost the weekend,bfbarry
like a bag of bricks,today hit me in the chest,keep moving forward,bfbarry
i know i know it,is not ignorance but bliss,it is enchanting,bfbarry
choices left unmade,to be true to disappoint,leave it to the heart,bfbarry
fermi questions me,why is humankind alone,are you sure we are,bfbarry
ask not of the lark,to explain its morning song,close eyes and listen,bfbarry
tell me how it feels,to have someone fight for you,will i ever know,bfbarry
torn paper too soon,steaming mud waits on my toes,with all hope burning,bfbarry
in a stream hunger,planted in soil in the trees,robins call nine lives,bfbarry
social media,stop scrolling through the stories,silence is needed,bfbarry
foliage throughout,campfires and warm sweatshirts,october smiles,bfbarry
in the excel sub,there's no middle ground you're,either smart or dumb,bfbarry
murmur of the brook,swallows up the highway roar,once your feet get wet,bfbarry
constantly trying,yet surrounded by mountains,life the biggest hike,bfbarry
the proudest monkey,swinging on a saxophone,limb to limb easy,bfbarry
i don't get tingles,what is this asmr,feels kind of silly,bfbarry
at sea you and i,tossed about safe harbor where,love guides our journey,bfbarry
to forge on and on,to push see feel grow yearn fail,learn to love and fail,bfbarry
trump sucks donkey dick,getting corona better,please god make it stop,bfbarry
back to the routine,return to normality,comfort in clockwork,bfbarry
by the frozen lake,on the slopes of the mountains,black bears hibernate,bfbarry
snow the mountain's crown,cloak of dusk about her feet,perfumed with wood smoke,bfbarry
named at conception,at birth loved and called to love,crooked is the way,bfbarry
prince had his purple,sir elton in goldfish boots,fickleness of pop,bfbarry
this imposing stone,offers no impediment,if i am water,bfbarry
the grape gives its life,so nectar has a story,told in every drop,bfbarry
where did the time go,haven't seen you in a while,dont forget my face,bfbarry
many facebook friends,we oft interact online,all of them are snakes,bfbarry
ate a big cookie,now i feel like complete ass,i regret that choice,bfbarry
how you surprised me,love freely given received,servant am i lord,bfbarry
gods with glowing boughs,ruby amber sparkling rime,beckon in the woods,bfbarry
mandalorian,baby yoda needs your strength,protect him always,bfbarry
took six hundred years,and defying gravity,just minutes to fall,bfbarry
don't fear the unknown,walk out into that darkness,your eyes will adjust,bfbarry
sunlight over time,mornings vibrant dawn chorus,night time chased away,bfbarry
leaves fall unperturbed,murderous are the storms,in spring,bfbarry
thoughts of you within,words written to express them,gift of love for you,bfbarry
haikus are quite nice,but sometimes they don't make sense,refrigerator,bfbarry
a strawberry shakes,as a field mouse loads its cheeks,while young tails await,bfbarry
your request i fill,even when you give no thanks,love is my reward,bfbarry
i lived in a house,and even slept in a bed,homeless nonetheless,bfbarry
unbearable heat,i step into the cold stream,a brief remedy,bfbarry
ice on yellow leaves,lizard hiding in bird's nest,keeping the birds warm,bfbarry
listen but not hear,losing a chance forever,never realizing,bfbarry
a drop of blood falls,the wind took it within,a dark sorrow moon,bfbarry
i have an ocean,for a heart and you're the ship,sailing upon it,bfbarry
rotting in one place,prisons of our own making,sometimes feel like home,bfbarry
in the neighborhood,signs divide the red and blue,you hate to see it,bfbarry
monika knows best,all the girls will now be gone,my poor doki friends,bfbarry
feeling flirtatious,i make a grab at your butt,oh frick my mom saw,bfbarry
the garden party,floated on polite laughter,and white wine spritzer,bfbarry
i'm still in the dark,but i see the light sometimes,'i am still going',bfbarry
today each hour filled,your presence brings me such joy,running with a smile,bfbarry
trepidation one's trepidation,feeling dread uneasiness,trembling fearfully,bfbarry
holding onto hope,sweet release from sanity,tearing me apart,bfbarry
no cure for the blues,turns computer off pours wine,googling symptoms,bfbarry
hazy moonlit fog,hangs upon the babbling brook,as though in slumber,bfbarry
sadness surrounds you,armor which isolates you,love seeks to break through,bfbarry
i ignored your text,but i saw you at the bar,i'm in love again,bfbarry
needed a haircut,saddly my flatmate obliged,now i blame myself,bfbarry
fissures split hills,thunder strikes birch,release,bfbarry
an unsure person,that is what i thought myself,then i changed my mind,bfbarry
a harsh drought sets in,the narrowing stream runs dry,fish lie motionless,bfbarry
dialing his number,until the telephone wire,turns her face purple,bfbarry
dusk seemed forever,when the moon had lost its light,it was a sunday,bfbarry
signs all around me,should i stay or should i go,i can't escape you,bfbarry
before your wedding,you said i was your best friend,now i am a ghost,bfbarry
pass over again,through war torn crying skin,keeps the mind off things,bfbarry
union with her sun,an elevated host is,the reflective moon,bfbarry
if you're feeling sad,come into my open arms,i will comfort you,bfbarry
why would i count sheep,with all of these anxious thoughts,visiting tonight,bfbarry
the last christmas gift,is doorway grandparents who,wrapped them in a kiss,bfbarry
it can be harmful,to follow the march of those,who go before us,bfbarry
a blown kiss with joy,the final ash falls me old home,leaving home dis thug think,bfbarry
stare into my eyes,old girl women have then loved,until you stared back out,bfbarry
springing forth rising,uninterrupted flower,sublime forever,bfbarry
we resonated,like sound of a chainsaw does,with a swarm of bees,bfbarry
could have had it all,bitter anger clouds the mind,get over it marc,bfbarry
heart pounding faster,thinking of our rendezvous,sliding off my chair,bfbarry
mind of the buddha,without beginning or or end,became like the sky,bfbarry
move over make room,night sky oh you've been much fun,new light break away,bfbarry
dunking the cookie,cold milk on hot summer day,a refreshing snack,bfbarry
lost i failed to pray,your love found saved me today,you are awesome lord,bfbarry
apathy within,my soul falters with this weight,stuck here in this hole,bfbarry
the rafters buckle,raining embers brush my sleeves,crayons make me cry,bfbarry
another haiku sub,itssnowingonmtfuji,best content ever,bfbarry
psychedelic truth,doublethink in jester's head,will never be said,bfbarry
we fought against it,the coming war to end war,with bullets and guns,bfbarry
a cool milky moon,spills through an open doorway,she drinks in silence,bfbarry
each strand a teardrop,but have peace your roots run deep,my weeping willow,bfbarry
fox peeks through laurels,white flowers buzzing with life,eyes watch butterfly,bfbarry
bought cherries off some,farm girl they tasted like hope,ripe's naivete,bfbarry
to be born at night,to look first upon the stars,dawn before the dawn,bfbarry
the physical pain,shoulders knees ankles and hips,ever present ache,bfbarry
rounding a corner,see it hanging low and red,unexpected moon,bfbarry
my great therapist,she really liked my haiku,the icarus one,bfbarry
hollywood learning,to read korean subtitles,somehow is progress,bfbarry
don't change who you are,for what society is,telling you to be,bfbarry
time continues by,a fading dream dissipates,decades wash away,bfbarry
woven lies,emotional cobweb strands,trap me like a fly,bfbarry
picota cherries,devoured on a steam train,through east of eden,bfbarry
the mirror greets me,no longer an enemy,always a stranger,bfbarry
leaves of golden hue,deer stumbles and leaps at sky,hunter drops hot mug,bfbarry
looking for answers,in the icons on a phone,sleepless morning looms,bfbarry
your my true soulmate,unrelenting self hatred,haunted by regret,bfbarry
her voice haunting me,whispers from a photograph,memories as ghosts,bfbarry
one hundred lashes,one hundred coats of lipstick,sixteen million views,bfbarry
rain on still petal,feel languid want of water,gorgeous vibration,bfbarry
queen victoria,matriarch of great britain,also great tv,bfbarry
your daddy was wrong,there is something waiting for,you outside your door,bfbarry
i am drowning here,this sea of missed connections,smothering my smile,bfbarry
specked pears hang and,wait beneath dark leaves to fall,into chartreuse grass,bfbarry
filled with pride,memories of times we shared,celebrating our love,bfbarry
familiar old tree,i remember when you were,a seed in my hand,bfbarry
they will be gone soon,waves of despair engulf me,there is no escape,bfbarry
open to your love,i find the path forward joy,your footprints my steps,bfbarry
crowded train at stop,people trying to get off,fucktards getting on,bfbarry
anyone else surprised,to see airplanes in the skies,we're cave people now,bfbarry
you've done a man's job,it's a shame she won't live,then again who does,bfbarry
mocking bird wonder,roaches scuttle ironic,in my room your eyes,bfbarry
haiku therapy,feelings in five seven five,a concise release,bfbarry
all the little things,making my young life go round,my dad watchmaker,bfbarry
my first childhood friend,a day thousand adventures,i will remember,bfbarry
livesserve god country,thanking god for your service,i will not forget,bfbarry
midnight on a farm,the crickets were cricketing,a slight mist floats in,bfbarry
if you must burn time,place the flame so friends enjoy,the warmth and the light,bfbarry
the potato that,is round and gold like the sun,must soon be eaten,bfbarry
proud sika scraping,crunching leaves gives way to chase,velvet emerges,bfbarry
the shitness on show,friends what shitness down below,other than haiku,bfbarry
today comes my way,positively beautiful,and without delay,bfbarry
my fears they emerge,smoke arises from embers,stars bat eyes of fire,bfbarry
we once talked all night,now we barely talk at all,where did we go wrong,bfbarry
the red thread of fate,spun by destiny's hands,a bond between two,bfbarry
beneath sky wonder,can dat shit begin leaving home,with all hope upon,bfbarry
room getting colder,showers taking me longer,more time to ponder,bfbarry
muck and mire heaven,belly down eating offal,an alligator,bfbarry
i'll take my brushes,and paint the sky blue just for,you and only you,bfbarry
ever the rebel,will you ever find peace joy,tears shed hope lives love,bfbarry
can the storm be quelled,or do we find ourselves in purgatory,a dilemma for all time,bfbarry
good thoughts then sad thoughts,everything reminds me ugh,how do i forget,bfbarry
you cannot help me,i don't want to hurt you so,please just go away,bfbarry
who is truly sane,in a world full of crazy,not for us to know,bfbarry
heavenly embrace,gently you tug at my clothes,caress of the wind,bfbarry
everyday i check,but lo and behold it says,coming soon sold out,bfbarry
brief was our visit,love expressed joy shared hearts warmed,cherished memories,bfbarry
in the willow tree,young lovers hide in secret,between the branches,bfbarry
fear breathes on my neck,hands on the wheel cataracts,bloom and eat the road,bfbarry
we walked for ages,looking for a better home,we yearned for the end,bfbarry
who is this woman,she has been here all along,waiting to be heard,bfbarry
red behind blue eyes,my deadly waning gibbous,life goes on and on,bfbarry
frowning impatient bored,participation brought forth such joy,smiling hoping living,bfbarry
malicious attack,smiling but get no smile back,victim number high,bfbarry
the cold bitter wind,that cuts straight through to the bone,also stokes the flame,bfbarry
my soft skin opens,draws you in earns your trust and,then swallows you up,bfbarry
when will i see you,i open my eyesit's you,forever are we,bfbarry
i give thee no fucks,there's not even one for me,no fucks to be seen,bfbarry
i want to be numb,or maybe just forgetful,what was i saying,bfbarry
in a rusted town,weeds entomb old rail road tracks,new necropolis,bfbarry
fashioned by a god,to live in a world enclosed,stuck in here with you,bfbarry
creative outlets,turn in to express outward,what do i look for,bfbarry
morbidly obese,and hydroxychloroquine,let me try it out,bfbarry
a struggle to breathe,an endless ongoing war,it will be okay,bfbarry
whether you stay home,or party till the sunrise,next year is your year,bfbarry
she could always wait,cigarette ash grew too long,i could only stare,bfbarry
that's just what we did,the difference a line can make,that's just what we did,bfbarry
maps and mysteries,will never lead love astray,with you at my side,bfbarry
eyes open still dark,reach for the phone to check time,oh my god my eyes,bfbarry
plant your toes in soil,nature nurtures life and love,your sole with your soul,bfbarry
when words leave your mouth,there is no taking them back,the tongue holds power,bfbarry
my head rings with thoughts,of you like a bell being,ravaged by the wind,bfbarry
improving with time,daily struggle for better,never giving up,bfbarry
pop the champagne flows,confetti of emotions,bubbles mix with blood,bfbarry
easter celebration continues,eight days to give thanks,he lives alleluia,bfbarry
always on my mind,your scent your smile your hands you,i want to hold you,bfbarry
testing my willpower,struggling hard to not succumb,to these confused thoughts,bfbarry
i have a problem,all my comments are haiku's,please send help post haste,bfbarry
a vowel dwelling,and a scrubby consonant,spelling out sparrows,bfbarry
beautiful night sky,like an oil spill caught ablaze,beauty is tragic,bfbarry
spill your emotions,for just ten seconds a day,and live hollowly,bfbarry
really wanna poop,coming out of my rectum,clenching really hard,bfbarry
fatigue from workday,the air tonight speaks of rain,tomorrow morning,bfbarry
out of the fire,but into the frying pan,will this ever change,bfbarry
it is our secret,why the bullet will shatter,brain memories faith,bfbarry
dark days loom longer,time will reveal the answers,patience is the key,bfbarry
the past isn't all bright,black pages should be read too,who says gray's boring,bfbarry
a tune we all know,a few notesmy mind is filled,and a smile erupts,bfbarry
coming home too soon,crushing leaves under my feet,am i worth it yet,bfbarry
in india she,will come her message will be,heard by everyone,bfbarry
easy to carry,reunite the mind and nature,haiku therapy,bfbarry
climbing with your help,with you the path is leveled,why do i worry,bfbarry
took refuge under,a celebration of leaves,wanting a reprise,bfbarry
one day that one foot,in front of the other is,the one in the grave,bfbarry
pulse of water calls,fireflies and nightingales,moonlit hinterland,bfbarry
friend can you forgive,so much lovesimply ignored,praychoose life choose love,bfbarry
ambiguous unclear,communicate in secret,a hidden message,bfbarry
happy puppy runs,flailing like an idiot,cutest thing ever,bfbarry
wings over water,a quick descent splash and grab,osprey gets his fish,bfbarry
i'm looking outside,leaves fluttering in the wind,very colorful,bfbarry
a distant whisper,of a forgotten leg hair,or a spider's path,bfbarry
atop her blanket,a cat lies comfortably,warmth and the nth nap,bfbarry
