line1,line2,line3,source
sun and winding hills,he drove i played online chess,long relaxing drive,bfbarry
we had it all wrong,death is really sweet relief,from contemplation,bfbarry
you don't have to fix,all the mistakes you have made,only learn from them,bfbarry
a sprawling shepherd,lounged in privacy from the,security sniff,bfbarry
coronavirus,coronavirus it sucks,coronavirus,bfbarry
hit my messy head,until everything just falls,into the right place,bfbarry
don't throw stones at me,or the mermaids will get you,where is the hallway,bfbarry
naked growth silenced,alongside suffocation,woven in darkness,bfbarry
days blur together,the unending solitude,keeps me company,bfbarry
thaw my bitter heart,fuck me like the world's ending,make me forget him,bfbarry
purple skies turn black,stars listen to our secrets,the sea plays our song,bfbarry
my brain is broken,i can't function normally,i'm always sorry,bfbarry
you're not on my mind,i don't think about you but,your voice is in it,bfbarry
lizzie borden stopped,and felt her mother's love but,evil consumed her,bfbarry
autumn convinces,trees to part from their leaves,and let them fly free,bfbarry
i never deserved,her love kindness or beauty,tears fall i regret,bfbarry
don't want to forget,a single moment of time,we spent together,bfbarry
the sea otters float,holding hands in the water,dreaming of oysters,bfbarry
now to forever,lost her ghost in this forest,trees watch silently,bfbarry
i made a mistake,i didn't mean forever,don't leave me alone,bfbarry
the female orgasm,the best sound on the planet,empty my wallet,bfbarry
drop i am nothing,how about you are you too,not even adieu,bfbarry
tainted memories,running circles in my head,could they at least walk,bfbarry
you are like the moon,an immense forbidden fruit,i wish to possess,bfbarry
powder falls from sky,death emerges from it's crypt,a new cycle starts,bfbarry
a knock on the door,but there is nobody home,nobody at all,bfbarry
take me to worship,i have come for deathless death,feed me blissful lies,bfbarry
my mind's made up,hopper isn't the year's mouthpiece,bosch did it better,bfbarry
finite bodies ache,shouldering the vast weight of,perpetuity,bfbarry
loved when you are born,nothingness you shall return,time to eat some corn,bfbarry
smudges of charcoal,and a smearing of gray for,november's easel,bfbarry
be true to thine self,a new season has arrived,desire steers her mind,bfbarry
should i wear a mask,they cannot make up their minds,better safe than sorry,bfbarry
religious people,jumping through the mental hoops,you must be athletes,bfbarry
my once tender heart,that i gave you easily,now calloused and bruised,bfbarry
my hands are so clean,unless i touch my glasses,did i eat bacon,bfbarry
the ashen sky comes,i wonder if it will rain,i need that soft touch,bfbarry
scrutinizing stares,from the ones you thought would care,makes you feel so bare,bfbarry
we are just debris,in an abyss found somewhere,but at least we're found,bfbarry
lavishing his love,reconciliation is,our butterfly kiss,bfbarry
if you hear the birds,in the morning as you wake,i hope you made it,bfbarry
strong arms hold her tight,she screams and fights her captor,in the mental ward,bfbarry
just see how we choke,on the words which we wish we,had never spoken,bfbarry
anger can consume,white hot lava soon to cool,sadness just lingers,bfbarry
ye olde winter shoppe,for february flakes and,licking icicles,bfbarry
forever silence,the moon lights up the night sky,i am not alone,bfbarry
piper always paid,the final breath still humming,it plays us off stage,bfbarry
at the end you see,everything i did not do,not what i did do,bfbarry
when i lay in bed,there's no escape from storm clouds,in my hollow head,bfbarry
exhaustion hits hard,the rescue squad fundraiser,chicken bbq,bfbarry
trampoline at dusk,playful feet and bouncing hair,sunsets on repeat,bfbarry
shepherd i hear you,you guide me past this boulder,our journey resumes,bfbarry
morning mushroom dew,a deer slips into the mist,my dog halts ears up,bfbarry
don't fear the night,the sun will rise tomorrow,and i'll be with you,bfbarry
mushrooms in my mouth,shitake on my tastebuds,portabella yeah,bfbarry
the first daffodil,shines yellow in the spring sun,alone not lonely,bfbarry
maths is so boring,derivatives integrals,all over my head,bfbarry
her clickety shoes,had men stealing glances at,their disappointment,bfbarry
i love ranch dressing,but too much is never good,my salads ruined,bfbarry
we breath the same air,i fell in love with a ghost,you're my afterlife,bfbarry
in april we wait,from the sky falls the snow flake,sun come out once more,bfbarry
the water boils,scent of lemon and ginger,keep me warm inside,bfbarry
time slipping away,final rest after sun sets,sleeping without grief,bfbarry
in our song of love,the fierce beating of her heart,drowning out all hope,bfbarry
intro music plays,last time on dragon ball z,kamehameha,bfbarry
cherished memories,you know us so perfectly,give us this day our,bfbarry
honoured nightingale,sad for your succession,happy you will sing,bfbarry
today i lost you,i feel cold and empty now,because i loved you,bfbarry
the two walk,hardly do they speak,the moon hears,bfbarry
times remembered love,joy that fills me is of you,hope lighting our path,bfbarry
i wouldn't have quit,if i had known just how rare,intelligence is,bfbarry
scorching desert wind,gerudo kings reject fate,lock up harsh power,bfbarry
i have lived this life,questioning my existence,hope someone listened,bfbarry
in the err of youth,i once killed a sparrow,ironic i can't fly,bfbarry
the day shall soon break,rest while the night is still young,eat bug tomorrow,bfbarry
you heard my prayer,answers brought me hope and peace,how perfect your love,bfbarry
i feel the warm sun,i hear the calm ocean waves,summer has begun,bfbarry
tree misses its leaves,yet today the grass is green,my coat hangs unused,bfbarry
the rain was salty,as it ran cold by my lips,fused with my own tears,bfbarry
blue then grey then black,all through a two by two square,i miss the wonder,bfbarry
petting the kitty,hand runs slowly through soft fur,mister kitty purrs,bfbarry
rain drenching the ground,sadness begins to creep in,regret overtakes,bfbarry
just don't go radio silent please,i promise i won't,were your last words to me,bfbarry
who talks in haikus,writes them online on their phone,but not to their spouse,bfbarry
split like old timber,no stock left this december,slow fading ember,bfbarry
i need whiskey and,your eyes are the same colour,i'll get drunk on them,bfbarry
rain overflowing,puddles in parking lot,caress of earl grey,bfbarry
hide crying in sun,scroll an endless contact list,alone and heavy,bfbarry
some people are just like shooting stars,they come they shine,and they go,bfbarry
soon you will be one,but your birth feels like yesterday,oh how time has flown,bfbarry
you really know,how to bring out the beauty,in the disasters,bfbarry
village idiot,no problem unless it is,a global village,bfbarry
i am not prepared,going into this last fight,hold onto my hand,bfbarry
standing tall and true,many branches but no leaves,tree made of metal,bfbarry
hell frozen over,a distro by microsoft,torvalds the victor,bfbarry
opportunity,two months to fifteen years,a fallen hero,bfbarry
my mind is worried,wicked snakes inside my place,questions never end,bfbarry
twelve bucks in the bank,loan application denied,no one buys my nudes,bfbarry
chocolate to caramel,sugar falls in the whirlpool,give me energy,bfbarry
that there is no love,i learn eventually,such an idiot,bfbarry
decorum decor,i and i alone decide,she proudly declared,bfbarry
early kitchen light,and early morning coffee,quiet dogs and plants,bfbarry
i look through the bars,on the rusted iron door,see her head resting,bfbarry
sun rays are always,falling around the desert,it makes my face warm,bfbarry
lurid attire was,envious of loveliness,wearing modesty,bfbarry
i tried to call you,no answer only voice mail,your voice made me smile,bfbarry
haikus start my day,sometimes blue and sometimes grey,but always the same,bfbarry
laughter we shared,such joy i will remember,touch of heaven,bfbarry
young bamboo shoots,rising from mounds of rich soil,full of green vigor,bfbarry
table covered with,yesterday's napkins and stuff,i will need later,bfbarry
surging through my veins,who said that tupac was dead,music frees his soul,bfbarry
sunshine hidden well,misery rains upon us,looking through the gloom,bfbarry
paint pictures,from within your mind,with language,bfbarry
the past cannot change,you don't owe them what remains,honor their love live,bfbarry
spring summer autumn,winter spring summer autumn,winter spring summer,bfbarry
slow as a glacier,extinction level event,we the internet,bfbarry
post men post women,delivering packages,spreading the disease,bfbarry
i lay here awake,my eyes glued to the ceiling,damn insomnia,bfbarry
a pregnant drop hangs,between this and the patter,love and life are lost,bfbarry
my train rumbles past,an empty baseball di'mond,kids kiss near first base,bfbarry
thank god for sweat pants,all day eating frozen foods,from my air fryer,bfbarry
i see alcohol,it falls down my throat easily,yet weighs on my soul,bfbarry
surrounded by grass,the silence is delicate,so vast yet so full,bfbarry
i dont like haikus,i mean they don't even rhyme,like seriously,bfbarry
whether willows weep,whether water wages war,we ware weathers will,bfbarry
have a book to read,thousand emotions arise,all in a page bind,bfbarry
you're always around,i can't get a break from you,just get the fuck out,bfbarry
i'm awful to him,he loves me more than i know,anger fuels his blood,bfbarry
let's get lyrical,may be more satirical,brain so whimsical,bfbarry
will never forget,although i probably should,brighter times ahead,bfbarry
my aunt used to say,slow and steady wins the race,she died in a fire,bfbarry
the hills are rolling,nature is so beautiful,the grass is flowing,bfbarry
iceberg memories,break away on currents of,dementia floes,bfbarry
christmas time is here,time to wrap a hundred gifts,will i get any,bfbarry
hopes and dreams crumbled,living on constant high alert,why stay on this path,bfbarry
green garden bucket,half full of yesterday's rain,frogs at home croaking,bfbarry
opioid sex slave,finds his next fix in a ditch,fentanyl last breath,bfbarry
ass red like baboon,swamp ass apocalypse now,gimme that goldbond,bfbarry
growth is always earned,a fool wanders aimlessly,plan action reflect,bfbarry
the girl i loved then,wasn't who i thought she was,which is a relief,bfbarry
blue flowers red thorns,donkey where is the princess,get out of my swamp,bfbarry
conjugal illusion,friendship pure,man upstairs unconditional love,bfbarry
please donate money,i'm homeless sir please dont leave,but why what's a simp,bfbarry
a walnut gavel,awaiting its turn to speak,amongst the chatter,bfbarry
so many humans,seems like life has no purpose,i guess it doesn't,bfbarry
sharp tongue,woke up with a,fat lip,bfbarry
somebody like you,there is no one quite like you,i only want you,bfbarry
the moments right here,look around you cant miss it,wait where did it go,bfbarry
a leaf flutters by,rejected from its one home,it will die alone,bfbarry
i am in a place,torn between a deep desire,to exist or fade,bfbarry
a walking taco,smashing chips with meat cheesebooze,then i'm smashed on couch,bfbarry
my partner is my guide,a beacon lighting my heart,my wife is my rock,bfbarry
you're thrown to the wolves,i'm bored of ultra violence,deaths angel arise,bfbarry
i do love big dic,tionaries they make me so hard,working fuck my ass,bfbarry
a porcelain vase,colourful flowers and green,synthetic nature,bfbarry
love of my lost heart,my relinquished feelings woe,left me eternal,bfbarry
a single yip had,set off the howling and it,avalanched through yards,bfbarry
seconds to decades,perpetually cloudy,where am i going,bfbarry
a lesson learned quick,nose in book and book on desk,youth has gone away,bfbarry
failing sunlight,across his face,the setting son,bfbarry
guitars pianos,drums bass singing writing,i smash it all yo,bfbarry
there a silent owl,perched still above the spring dusk,wise beyond his ears,bfbarry
one among many,isolated in a crowd,watch as the one rots,bfbarry
silence i sit still,how long unsure piano,notes suddenly ring,bfbarry
i am not ready,for this or anything else,so please wait for me,bfbarry
cats are cute,so are dogs,i like your smile it's nice,bfbarry
penised her so good,she fell asleep on my face,shit can't reach my phone,bfbarry
whirlwind of nothing,a blender of loneliness,smoothee of myself,bfbarry
yet you still smoulder,an untamed blaze for all souls,gifted mystery,bfbarry
unbroken water,frog hasn't jumped to old pond,sound of stare out eyes,bfbarry
breathe in hold breathe out,feel the air enter your soul,repeat until calm,bfbarry
my chest is still warm,from the last hug you gave me,my eternal spring,bfbarry
cut my veins and feed,drink the red blood of my soul,poetry you vampire,bfbarry
i wrote this poem,the gatekeeper frowns delete,smug satisfaction,bfbarry
summer cheeks flushed red,his flesh that of a stone fruit,full i consume thee,bfbarry
my cat weighed two stone,yet the hummingbirds still know,the branches she reached,bfbarry
how can such beauty,become simply forgotten,a thing of the past,bfbarry
bare feet in a field,ouch a spiky prickly plant,how well we have it,bfbarry
alone as always,only my tears touch the ground,as life fades away,bfbarry
eighteen years have passed,sharp blue sky with no contrails,a deep sad autumn,bfbarry
most sleep with the sun,but me and my love luna,we stargaze all night,bfbarry
you look like art when,you smile in my direction,priceless beautiful,bfbarry
old wooden gate slams,startled a young crow takes flight,wakes me from a thought,bfbarry
unemployed new grad,top school top grades top degree,what more do they want,bfbarry
asking for a friend,online means more than one thing,shame or loneliness,bfbarry
the sadness i feel,is one i have never felt,make it go away,bfbarry
bird of paradise,my nest was not enough but,you left a feather,bfbarry
just watched the oscars,no one was running the show,much like the white house,bfbarry
floating slowing down,falling drifting deeper now,sleep and rest your crown,bfbarry
whisper of roses,the winds carried it to her,hands hide her red checks,bfbarry
they're talking to me,but they don't say any words,they speak in colours,bfbarry
slanted golden rays,light birdsong and reverie,at dawn poet's day,bfbarry
ground dark roasted beans,wafting aroma caffeine,a cup steaming hot,bfbarry
skimming stones on rain,falling brief as phases go,faint traces of puddles,bfbarry
i wait for your end,grey february long march,andale vite,bfbarry
laughing spirits high,reconnecting old lost friends,with dry wood crackling,bfbarry
i will always be,your house plant stuck and waiting,for you to come home,bfbarry
yonder is our star,dimming fading in the sky,why are you so far,bfbarry
teleworking day,spent an hour explaining zoom,to older colleagues,bfbarry
diesel truck running,birds chirping to greet march,pull blankets higher,bfbarry
the wiggles were right,fruit salad yummy yummy,best part of summer,bfbarry
doggo says hello,i want to boop that sniffer,and tickle those ears,bfbarry
canes at the ready,the old men argue a point,same place every day,bfbarry
glory unstrapped freed,big wiggling jigglers,to motorboat squeeze,bfbarry
we don't talk about,our childhood we just express,the habit of fear,bfbarry
a red rose rises,out of the thick milky black,bathed by your shadow,bfbarry
net neutrality,we will miss so much that thing,fuck you ajat pai,bfbarry
my laundry pocket,held september's note when the,acorn had dropped in,bfbarry
you carry the scent,of every man that made you,an ancient love spell,bfbarry
carry me to depths,but let me not dwell in them,i still want to hope,bfbarry
it bitterly aches,to love somebody that hates,someone that you love,bfbarry
they claimed it was hard,i watched it destroy their grades,i have no regrets,bfbarry
up in the far sky,the big star is shining bright,i think i miss you,bfbarry
always do your best,won or lost follow the way,lessons learned repeat,bfbarry
mixing a drink with,holy water unabsolved,the sins that follow,bfbarry
salt flowers bloom,on dessert lake without color,high sun no shadows,bfbarry
coronavirus,the dinner party hosted,over video,bfbarry
am i but the wind,swiftly blowing through your leaves,then stillness again,bfbarry
when i was younger,i told the moon and the stars,all of my secrets,bfbarry
not a wordly care,beyond that of eat sleep drink,can i be a cow,bfbarry
short set of haiku,for all of you to enjoy,please read the full post,bfbarry
time has become a,homogeneous mixture,temporal smoothie,bfbarry
the scent in the air,the loneliness consumes me,am i strong enough,bfbarry
farted in the bed,surprised the sheets aren't burned,volcano downtown,bfbarry
a laugh made of wax,and a house made of butter,melted that summer,bfbarry
did we connect friend,love exchanged but joy escaped,hope carries us forth,bfbarry
was it all a dream,i most certainly hope not,that was happiness,bfbarry
i was in half sleep,flash glimpse of light manifest,arm sleeve strange device,bfbarry
all eyes diverted,to a turquoise bikini,shifting on the sand,bfbarry
vomit stench wet sheets,happy bath all better now,false hope still real sick,bfbarry
anxiety,tight throat crushing my dreams,cool flow bring me back to life,bfbarry
as summer ends,the shades project their shadows,warmth is comforting,bfbarry
the nurse nurtures wounds,spy collects reconnaissance,hunter stalks his prey,bfbarry
why even bother,when time runs so slowly,to rush through your life,bfbarry
sushi is so good,i am glad this fish tastes good,the fish is also glad,bfbarry
drifting downward the,steeple had nearly punctured,a floating blue moon,bfbarry
what do we desire,it can be one thing only,love and happiness,bfbarry
come away with me,let our love be our guidance,set our hearts on fire,bfbarry
fast and short and sweet,is how to write a haiku,short attention span,bfbarry
a happy life is,lived in perfect accordance,with its own nature,bfbarry
cottage cheese thighs were,distracting the pew in a,skirting of distaste,bfbarry
lonely in a crowd,lonely in an empty room,what's a girl to do,bfbarry
we all have soul mates,some are friends some are lovers,some are kind strangers,bfbarry
if the world's a stage,why do i feel like a prop,bring on the last act,bfbarry
the order is called,a beam of misguided rage,even the younglings,bfbarry
dreams in a snow globe,unconventional romance,life has been shaken,bfbarry
mercy forgiveness,drop the stone and walk away,now follow the lamb,bfbarry
raven looks at me,i still stare back wondering,if i see his ghosts,bfbarry
midnight bells call her,i'm left with a glass slipper,she does not want back,bfbarry
soft winds sway the pines,and mossy oaks wave goodbye,as the sun retreats,bfbarry
a piece of her soul,slid off her shoulder today,no one bat an eye,bfbarry
the trade winds whispers,making the leaves and trees dance,breathing life to them,bfbarry
smiles with family,only makes me feel bitter,where were you before,bfbarry
some people like to,create their own storms then get,upset when it rains,bfbarry
it's been some time friend,should i call you that let me,introduce myself,bfbarry
we fight cuz we're bored,we are circling talking,look for openings,bfbarry
what do we put in,the post's description below,mogami river,bfbarry
a robin chirping,bright spring sunshine on my book,i'm reading koans,bfbarry
suffering starts not,with the fall but the sheer will,to pick yourself up,bfbarry
stage two cancer but,a dedicated teacher,classes continue,bfbarry
amazing beauty,she's so far away from me,dark hair in summer breeze,bfbarry
say that i'm not me,i'm the one who said that though,woah that's too deep man,bfbarry
last turn of the moon,luna fed round above looms,i will be home soon,bfbarry
hillside of flowers,stretching for countless miles,but not yet in bloom,bfbarry
watching the wheels turn,learning to enjoy the ride,passenger in life,bfbarry
traveling,to where you are right now,wouldn't that be a trick,bfbarry
graveside raining was,a scallop of sorrow in,grieving umbrellas,bfbarry
world poetry day,even the magpie's squawking,has become haiku,bfbarry
currently we know,several different ways,the internet broke,bfbarry
year nineteen sixty,thou shall not speak a promise,of going to church,bfbarry
friend you surprised me,for a moment we met shared,joy to remember,bfbarry
the sad romantic,cries himself to sleep tonight,without shedding tears,bfbarry
before going blind,i wish to see aurora,dancing in the sky,bfbarry
elated heart pumps,everything blurs save them,steps falter from thought,bfbarry
sweat rolling down brow,pavement reflects scorching heat,outdoor weightlifting,bfbarry
neurons fire tail wags,tongue darts out left right and up,small treat accepted,bfbarry
i the heavy stone,your words the raging river,the waters change me,bfbarry
need encouragement,making myself positive,i want happiness,bfbarry
constant discussions,we never seem to agree,still laughing loudly,bfbarry
for the manicure,trimmed and polished by the sun,the moon left a tip,bfbarry
sour mandarin,your sweetness quickly faded,yet peelings remain,bfbarry
what i desire,is not money or clothes or jewels,but to hold his hand,bfbarry
my fears emerging,i dream of being lost in,your blooming presence,bfbarry
roommate mentions the,prophet zoroaster then,clams up won't say more,bfbarry
what a great burden,honesty becomes such pain,the lies continue,bfbarry
creating haiku's,unsure if this is allowed,doing it anyway,bfbarry
you cry for family,cry for friends cry for yourself,in the bitter end,bfbarry
sun hit me like a,brick who the fuck dropped the sun,some rascal that's who,bfbarry
if i learned to hate,it might not feel like my fault,i wish you loved me,bfbarry
how many times lord,how many times will i stray,and you come find me,bfbarry
my therapist said,i should not post on reddit,i just don't listen,bfbarry
scroll scroll scroll refresh,in the dark a dying light,three two one percent good night,bfbarry
of rain and seasons,of rivers birds and of trees,haiku not senryu,bfbarry
harsh melancholy,accompanied by regret,no abolishment,bfbarry
i wrote a haiku,about a kite because i,am as high as one,bfbarry
i saw the reaper,at the bottom of each glass,each refill more grim,bfbarry
death came invited,politely asked for a drink,and so you obliged,bfbarry
little birds sing songs,they are very full of life,one day it will end,bfbarry
you grew up around,some toxic people i will,never forgive them,bfbarry
hazy perplexed eyes,stung by venom of the sun,watered by the light,bfbarry
drink and smoke to cope,bury my heart six feet deep,let time fill the hole,bfbarry
many songs to sing,as a jailbird eyes the cage,can you hear the tweets,bfbarry
falling out of reach,noodles are so slippery,but ramen is good,bfbarry
lasagna for lunch,clear skies white clouds and slow jazz,canicular blues,bfbarry
heart knows what it wants,i dream of love and romance,but wake up alone,bfbarry
my own favorites,autobiographical,my stories my lies,bfbarry
lol again,after everything you say,lol again,bfbarry
miracle of me,wonder of you fills my love,we share joy and hope,bfbarry
formidable foe,if not enemy teacher,a tarot reading,bfbarry
for motivation,to sink in effort required,believe to achieve,bfbarry
stupid human race,ignoring giant space rocks,the greatest filter,bfbarry
gears turning winding,drab smoke coats a hazy sky,nature made machine,bfbarry
god's architecture,thoughts unattended alone,palatial estates,bfbarry
thoughts in saffron robes,before the pebble garden,focusing silence,bfbarry
imagine we all,spoke only using haiku,succinct eloquence,bfbarry
o mother my queen,i miss the warmth of your womb,wish i died in there,bfbarry
my dear does not dream,for she is always busy,occupying mine,bfbarry
gentle vibration,city life goes unnoticed,you have arrived,bfbarry
the hunter is back,the dark clouds are his cover,the cold wind his gift,bfbarry
cold from head to toe,looking for the sun rays warm air,nowa hot shower,bfbarry
i feel the alcohol,slowly rinsing who i was,i don't belong here,bfbarry
her boyfriend is home,her eyes light up like the moon,i reach for my pants,bfbarry
three in the morning,i awake to him staring,unblinking at me,bfbarry
i'd like to know,who runs this world so i can,demand a refund,bfbarry
golden aura cat,will you please light up my way,push me through the dark,bfbarry
i will fail this class,one more year that goes to waste,it could not be worse,bfbarry
the absurdity,of people thinking they know,anything at all,bfbarry
the god is yet born,dark will continue to grow,with collective might,bfbarry
today i lost you,but more like a year ago,i had lost myself,bfbarry
a stable mindset,balance is bliss in the storm,continue searching,bfbarry
unending heartbreak,the great sorrow of us all,everything dies,bfbarry
watching the sun rise,something awoke within me,my indigestion,bfbarry
ponderous despair,learn from our mortality,fart breaks the silence,bfbarry
dragged myself to work,awake but am scatter brained,path least resistance,bfbarry
smoke on a rainy night,thoughts of her,a salty waterdrop is heavier,bfbarry
i talk myself up,perception's always biased,i am full of shit,bfbarry
remember when we would kiss,under the hot pines,the feeling,bfbarry
i hope to see you,as i walk round the corner,but you're never there,bfbarry
warm sun children play,filled with thanks and easter joy,a peak of heaven,bfbarry
fleeting form of joy,gone in a blink of an eye,ethereal you,bfbarry
your love is rain,my heart awaits underground,blossoming skyward,bfbarry
raging sunset fire,turns to icy moonlight cold,the disquiet grows,bfbarry
throwing your garbage,into the recycling bin,will not save the earth,bfbarry
tonsil surgery,no hot no cold no solid,and i got fired,bfbarry
